{
  "schemaVersion": "1.0",
  "sourceInventoryPath": "sources/ASSET_INVENTORY.csv",
  "sourceInventorySha256": "c576bed56647e01e23de890aa45225d92adea057f5b4498ffbdc9bd383daf011",
  "records": [
    {
      "sourcePath": "packs/official/01-subject-identity/manifest.json",
      "sourceSha256": "17ed4bf487b7ab3337a855ecc4b432046a4112293c8e811a0134c82c733ddbde",
      "historicalPath": "sources/packs/official/01-subject-identity/manifest.json",
      "normalizedPath": "official/01-subject-identity/manifest.json",
      "packId": "official.category-01.subject-identity.v1",
      "unchanged": [
        "pack_id value",
        "version",
        "display_name",
        "exemplar IDs/titles/approved_features/known_defects/tags",
        "option IDs/labels"
      ],
      "transformed": [
        "snake_case to camelCase; schema_version to 1.0",
        "asset paths to static library-relative references with hash/media type",
        "documents to typed asset records",
        "licenses to explicit intended/unknown status",
        "notes to compatibility.notes",
        "examples preserved as supporting evidence in asset ledger",
        "governs and does_not_govern carried forward",
        "status user-endorsed retained as development approval through source backup and approvedFeatures; no rights promotion",
        "description carried forward except Category 4 rewritten under approved color amendment",
        "source license strings mapped to intended or unknown; exact statements retained in historical manifest"
      ],
      "added": [
        "typed documents with source-derived filename titles; document IDs; exact asset hashes/media types; generic tags from approved sheet",
        "compatibility",
        "typed option category/axis/value",
        "empty arrays for unspecified presets/strategies/roles/relationships",
        "explicit unresolved public redistribution caveats",
        "pack tags copied from approved-sheet tags; source-relative mapping for all option/exemplar/document/preset records"
      ],
      "unresolved": [
        "precise artistic parameters beyond supplied option labels",
        "independent rights verification",
        "knownDefects empty means none supplied, not a defect-free certification"
      ],
      "caveats": [
        "Official is curated development provenance, not a rights certification.",
        "Metadata CC-BY-4.0 intended; visual redistribution unresolved."
      ],
      "options": [
        {
          "normalizedId": "front-view",
          "sourcePointer": "/options/0"
        },
        {
          "normalizedId": "three-quarter-view",
          "sourcePointer": "/options/1"
        },
        {
          "normalizedId": "profile",
          "sourcePointer": "/options/2"
        },
        {
          "normalizedId": "over-shoulder",
          "sourcePointer": "/options/3"
        },
        {
          "normalizedId": "confident-expression",
          "sourcePointer": "/options/4"
        },
        {
          "normalizedId": "playful-expression",
          "sourcePointer": "/options/5"
        },
        {
          "normalizedId": "serious-expression",
          "sourcePointer": "/options/6"
        },
        {
          "normalizedId": "laughing-expression",
          "sourcePointer": "/options/7"
        }
      ],
      "exemplars": [
        {
          "normalizedId": "category-01-sheet",
          "sourcePointer": "/exemplars/0",
          "sourceAsset": "packs/official/01-subject-identity/exemplars/category-01-approved-sheet.png"
        }
      ],
      "documents": [],
      "presets": []
    },
    {
      "sourcePath": "packs/official/02-conventional-composition/manifest.json",
      "sourceSha256": "07810f0364d98072626968229d27b3d87c7f5e8b3432990d725e59cc16e6d875",
      "historicalPath": "sources/packs/official/02-conventional-composition/manifest.json",
      "normalizedPath": "official/02-conventional-composition/manifest.json",
      "packId": "official.category-02.conventional-composition.v1",
      "unchanged": [
        "pack_id value",
        "version",
        "display_name",
        "exemplar IDs/titles/approved_features/known_defects/tags",
        "option IDs/labels"
      ],
      "transformed": [
        "snake_case to camelCase; schema_version to 1.0",
        "asset paths to static library-relative references with hash/media type",
        "documents to typed asset records",
        "licenses to explicit intended/unknown status",
        "notes to compatibility.notes",
        "examples preserved as supporting evidence in asset ledger",
        "governs and does_not_govern carried forward",
        "status user-endorsed retained as development approval through source backup and approvedFeatures; no rights promotion",
        "description carried forward except Category 4 rewritten under approved color amendment",
        "source license strings mapped to intended or unknown; exact statements retained in historical manifest"
      ],
      "added": [
        "typed documents with source-derived filename titles; document IDs; exact asset hashes/media types; generic tags from approved sheet",
        "compatibility",
        "typed option category/axis/value",
        "empty arrays for unspecified presets/strategies/roles/relationships",
        "explicit unresolved public redistribution caveats",
        "pack tags copied from approved-sheet tags; source-relative mapping for all option/exemplar/document/preset records"
      ],
      "unresolved": [
        "precise artistic parameters beyond supplied option labels",
        "independent rights verification",
        "knownDefects empty means none supplied, not a defect-free certification"
      ],
      "caveats": [
        "Official is curated development provenance, not a rights certification.",
        "Metadata CC-BY-4.0 intended; visual redistribution unresolved."
      ],
      "options": [
        {
          "normalizedId": "head-and-shoulders",
          "sourcePointer": "/options/0"
        },
        {
          "normalizedId": "bust-chest-up",
          "sourcePointer": "/options/1"
        },
        {
          "normalizedId": "half-length",
          "sourcePointer": "/options/2"
        },
        {
          "normalizedId": "three-quarter-length",
          "sourcePointer": "/options/3"
        },
        {
          "normalizedId": "full-length",
          "sourcePointer": "/options/4"
        }
      ],
      "exemplars": [
        {
          "normalizedId": "category-02-sheet",
          "sourcePointer": "/exemplars/0",
          "sourceAsset": "packs/official/02-conventional-composition/exemplars/category-02-approved-sheet.png"
        }
      ],
      "documents": [
        {
          "normalizedId": "official.category-02.conventional-composition.v1.document-1",
          "sourcePointer": "/documents/0",
          "sourceAsset": "packs/official/02-conventional-composition/documents/CONVENTIONAL_COMPOSITION_REFERENCE_LIBRARY_v1.pdf"
        }
      ],
      "presets": []
    },
    {
      "sourcePath": "packs/official/03-unconventional-composition/manifest.json",
      "sourceSha256": "cec31876f3e815c8b8103d32bdc9acdf47b7773406175aec8e76197529d81a75",
      "historicalPath": "sources/packs/official/03-unconventional-composition/manifest.json",
      "normalizedPath": "official/03-unconventional-composition/manifest.json",
      "packId": "official.category-03.unconventional-composition.v1",
      "unchanged": [
        "pack_id value",
        "version",
        "display_name",
        "exemplar IDs/titles/approved_features/known_defects/tags",
        "option IDs/labels"
      ],
      "transformed": [
        "snake_case to camelCase; schema_version to 1.0",
        "asset paths to static library-relative references with hash/media type",
        "documents to typed asset records",
        "licenses to explicit intended/unknown status",
        "notes to compatibility.notes",
        "examples preserved as supporting evidence in asset ledger",
        "governs and does_not_govern carried forward",
        "status user-endorsed retained as development approval through source backup and approvedFeatures; no rights promotion",
        "description carried forward except Category 4 rewritten under approved color amendment",
        "source license strings mapped to intended or unknown; exact statements retained in historical manifest"
      ],
      "added": [
        "typed documents with source-derived filename titles; document IDs; exact asset hashes/media types; generic tags from approved sheet",
        "compatibility",
        "typed option category/axis/value",
        "empty arrays for unspecified presets/strategies/roles/relationships",
        "explicit unresolved public redistribution caveats",
        "pack tags copied from approved-sheet tags; source-relative mapping for all option/exemplar/document/preset records"
      ],
      "unresolved": [
        "precise artistic parameters beyond supplied option labels",
        "independent rights verification",
        "knownDefects empty means none supplied, not a defect-free certification"
      ],
      "caveats": [
        "Official is curated development provenance, not a rights certification.",
        "Metadata CC-BY-4.0 intended; visual redistribution unresolved."
      ],
      "options": [
        {
          "normalizedId": "extreme-negative-space",
          "sourcePointer": "/options/0"
        },
        {
          "normalizedId": "aggressive-crop",
          "sourcePointer": "/options/1"
        },
        {
          "normalizedId": "extreme-high-viewpoint",
          "sourcePointer": "/options/2"
        },
        {
          "normalizedId": "extreme-low-viewpoint",
          "sourcePointer": "/options/3"
        },
        {
          "normalizedId": "dutch-canted-frame",
          "sourcePointer": "/options/4"
        },
        {